description,genre
seventeenyearold anna finds herself on the run from her fathers enigmatic agency along with the four teen boys the agency had been experimenting on as they try to make sense of erased memories secret identities and genetic alteration,science_fiction
examines the life of the actor who became popular as mr spock on the television series star trek and later branched out into writing poetry and directing some of the star trek films,science_fiction
zac gets into all sorts of trouble while thoughtlinked to beta a boy living in the year 5010 who needs his help on a history assignment but when twentiethcentury zac needs help with a project on the romans beta is gone,science_fiction
k13 the best spy in the secret service must retrieve the deadly crumblebomb from the worlds greediest man who is holding it for ransom,science_fiction
doctor docters energy replenerator turns daniel aka loud boy and his superhero friends into pruneeating canewielding old people,science_fiction
tasked with ending the fighting on a wartorn world a platoon of clone troopers find their plans undone but must still continue their flawed missionprovided by publisher,science_fiction
daniel hunting an intergalactic criminal that takes the form of fire is reminded of the murders of his parents and must go back in time to the demons arrival in the dark ages in order to save his friends the coauthor is adam sadler volume 3using his incredible abilities daniel x continues to track down intergalactic criminals bringing their alien brand of evil to earth the next target on the list is phosphorius beta an explosive demon of fire with a legion of flameweaving henchmen even though his own powers have grown since taking down number 5 the only chance daniel has of beating this ancient demon is to go back in time to the dark ages and destroy beta before his blistering reign has a chance to even begin but can daniel x take the heat or will the alien hunter finally get burnedp 4 of cover,science_fiction
kayla and mishalla two genetically engineered nonhuman slaves gens fall in love with higherstatus boys discover deep secrets about the creation of gens and find out what it means to be human,science_fiction
in a future manhattan devastated by environmental catastrophes and epidemics sixteenyearold lucy survives alone until vicious hounds target her and force her to join aidan and his band but soon they learn that she is the target of sweepers who kidnap and infect people with plague,science_fiction
introduces the dark world of the evil sith describing their powers and ruthless plots to take over the galaxy,science_fiction
mark struggles to make sense of his new postdisaster world in this prequel to the maze runner,science_fiction
in 2083 orphan shama katooee who has just stolen an expensive pet bird is mysteriously selected to attend the elite chronos academy to be trained in the practice of timewatch although she has no idea how or why she has been given this honor,science_fiction
chorkle and its human friends hollins twins becky and nicki and little gus who is now lobbying to be called medium gus have been warped to a strange new galaxy when kalac is stranded on neighboring planet kyral the gang takes matters into its own hands and tholgrazes and sets off on a daring rescue missionchorkle narrates the adventures of earth children hollins becky nicki and little gus marooned on his asteroid gelo as he watches over them with his five eyes teaches them to fight a ferocious thysscat and seeks a way to get them home book 1,science_fiction
high school senior cara sweeney gets more than she bargained for when she agrees to participate in earths first intergalactic high school exchange programhighschool senior cara sweeney gets more than she bargained for when she agrees to participate in earths first intergalactic highschool exchange program the plot contains profanity sexual situations and violence book 1,science_fiction
having traveled in her time machine to the court of kublai khan kat comes to the aid of a mongolian princess who is facing a fearful future,science_fiction
when josh learn that a special artifact the bracelet of itzamna is the key to both his fathers death and the mystery of the codex he returns to the hidden city of ek naabalone this time because as the stakes rise he can no longer trust even his closest allies,science_fiction
tora reynolds has escaped to a new planet but must fight against the consulate and a rebel leader to find and destroy her fathers guns,science_fiction
when alex discovers that rule is not a sanctuary she must battle to survive against conniving adults distrusting survivors and the changed who would eat her alive,science_fiction
as jackson recovers from his brush with death surrounded by his father courtney holly and a few of the original time travelers it becomes clear that they need to stop thomas and dr ludwigs experiments at eyewall headquarters triggering a war jackson was born to fightas jackson recovers from his brush with death surrounded by his father and a few of the original time travelers it becomes clear that they need to stop dr ludwigs experiments the plot contains profanity sexual situations and violence book 3,science_fiction
dr moreaus daughter juliet travels to her estranged fathers island only to encounter murder medical horrors and a love triangle,science_fiction
in a postapocalyptic world where nothing is as it seems seventeenyearold amy and baby a child she found while scavenging struggle to survive while vicious predatory creatures from another planet roam the earthin a postapocalyptic world in which nothing is as it seems sixteenyearold amy and baby a child she found while scavenging struggle to survive while vicious predatory creatures roam earth the plot contains profanity and violence,science_fiction
the theft of nickel ingots from asteroid nma6 provides a puzzling mystery until members of spaceship em 88 step in to investigate,science_fiction
finding a neighboring tribe of duloks has been enslaved by the empire and a legendary beast has been awakened the peaceful ewoks prepare to deal with two powerful foes,science_fiction
someone is releasing secret subliminal messages about the mews through the television and the internet the messages such as down with the mew mew and hate the mews are working everyone into a mewhating frenzyeven mew berrys crush,science_fiction
a thousand years after the release of the straker tapes when peter and alpha discover that stories of human upgrades are true they strive to stop a group of scientists from making a decision that could destroy humanity,science_fiction
cassie a telepathic teenager is on the run from government trackers because she is a paranormal in a world where being a para is illegal,science_fiction
elissa used to have it all looks popularity and a bright future now all she has is nightmarish visions and unexplained bruises finally shes promised a cure and a surgery is scheduled but on the eve of the procedure she discovers the truth behind her visions shes seeing the world through another girls eyes a world filled with pain and wires and weird machines elissa follows her visions only to find a battered broken girl on the run a girllinwho looks exactly like elissa down to the matching bruises a twin she never knew existedelissa helps lin evade the government agents who are ruthlessly tracking her down but theyre struggling to avoid capture and soon elissa is forced to turn to the only person who can help cadan her brothers infuriating arrogant best friend and new graduate of the sfi space flight academy cadan is their one chance at safety but lin is too valuable to let go and elissa has knowledge that is too dangerous the government will stop at nothing to get them back,science_fiction
when atrocitus leader of the red lanterns hatches a plan to drain all the underground water from mars it is up to hal jordan and his green lantern corps teammates to stop him and save the precious resource that earth may soon need to supplement its own polluted oceans,science_fiction
after breaking a record by scoring over one million on the starfighters video game alex is recruited by beings from the planet rylos to fight in a war to save the universe,science_fiction
heroic astronaut captain cal and his brave crew embark on a dangerous mission to save the earths water supply from fiendish space aliens,science_fiction
as five crippled children play games of imagining themselves in another beautiful world one of the boys finds he can help the rest of them escape to a strange new place,science_fiction
the newest animorph may prove a greater threat to the team than the yeerks who are again threatening the world,science_fiction
eking out a desperate existence as a renegade with the other portkids who hide in the old tunnels under a spaceport on mars the teenager known as streak stumbles on clues to the sabotage plaguing the entire solar system,science_fiction
seventeenyearold christopher is kidnapped from earth to serve as a pawn for benharran a renegade galactic controller in his fight against the council of atui and its policies of planetary control,science_fiction
willy the bear is summoned to texas to help his cousins outwit some green critters and gets his name changed,science_fiction
with the defences of the southern appalachians sundered the only thing standing between the ravening posleen hordes and the soft interior of the cumberland plateau are the veterans of the 555th mobile infantry dropped into rabun pass the only question is which will run out first power bullets or bodies,science_fiction
humans having been driven by the cylons from the last surviving colonies in the universe and hoping to find earth their last chance for help must battle the destructive cylons again from their craft in space,science_fiction
in the future cloned brothers evonn and stefan escape from behind the iron curtain to search for their father in the united states,science_fiction
in the first story a tenyearold boy  discovers that dreams are a way of traveling through the universe and in the second a boy is caught in the middle of a battle between his robot buddy and his father,science_fiction
in their scheme to conquer earth the evil gobots try to convert the planets salt reserves into energex a compound which will give them super powers,science_fiction
a biography of the thirtysecond president who in four consecutive terms of office led the country through the depression and world war ii,science_fiction
two outlaw planets are hurtling toward earth  and only a chosen few will escape to planet beta b,science_fiction
betrayed after defeating the morbuzakh and the krahka three of the toa metru are arrested and learn more about their new powers from a mysterious stranger in prison,science_fiction
the animorphs must use a giant squid morph to rescue their android friends the chee who are stuck in a deep trench on the ocean floor and they have to get there before visser three does,science_fiction
fifteenyearold darren a social misfit who spends his time at school trying not to be noticed while drawing characters for a planned film series and book tieins befriends eric another outcast who reveals that he never sleeps,science_fiction
rhyming tale of a primary school student whose concern about germs leads him to create a potion that not only cures every disease on earth it grows a little hair as well,science_fiction
when a young boys sodapop stretching device explodes he discovers he has created a material valuable to the united states government because it eliminates friction and he is soon being pursued by spies who want the formula for their own government,science_fiction
the time has come for maxfang iggy nudge gasman and angel to face their ultimate enemy and despite many obstacles try to save the world from a sinister plan to reengineer a select population into a scientifically superior master race,science_fiction
stranded on an unknown planet when their spaceship runs out of fuel the jameson family must rely on their robot to save their lives,science_fiction
soon after being exiled to the planet klydor five young people begin to suspect that their struggle for survival is somehow linked to the rebel uprising against the earths harshly authoritarian government,science_fiction
in 2097 men are a small and controlled minority in a utopian world ruled by women and fourteenyearold kellen must fight to save his father from an outbreak of the virus that killed ninetyseven percent of the male population thirty years earlier,science_fiction
the rescue bots latest mission is to help an island community weather a severe storm after the storm passes the local residents ask the bots for help finding the settlers bell that was stolen 200 years ago by pirates can the rescue bots find the bell in time for pioneer day,science_fiction
after his girlfriend holly is fatally shot during a violent struggle nineteenyearold jackson uses his supernatural abilities and travels back in time two years where he falls in love with holly all over again learns that his father is a spy and discovers powerful enemies of time who will stop at nothing to recruit him for their own purposes,science_fiction
a mechanical bone invented by jimmy neutron leads his pet dog goddard astray and into the hands of fiendish robots,science_fiction
fifteenyearold jack is sent to 1914 europe as a pawn in the battle between his longlost father who has built a time machine and a secret network of scientists who want to prevent him from trying to use it to change history for the better includes historical notes,science_fiction
twelveyearold ginnela and her younger brother pete find themselves trapped on a disabled spaceship and must figure out how to survive,science_fiction
at bedtime a little girl and her father play a game in which each imagines what it would be like to be the other for a day,science_fiction
an anthology of original stories featuring the edgar rice burroughs character john carter an earthman who suddenly finds himself on a strange new world mars,science_fiction
in a tokyo of the nottoodistant future a young girl looks up to the stars with melancholy in her heart and hope in her eyes thirteenyearold asumi kamogawas whole life has been tied to those stars her future may very well be among them and she is not alone asumi is just one of many young people with ambitions to become a member of the first class admitted to the tokyo space school in this first volume asumi is put to the test to determine if she has what it takes to get into this elite space academy her struggles do not begin in the classroom or at the test site though first asumi has to convince herself and her father that she ultimately belongs amongst the starsp 4 of cover,science_fiction
ghosts are appearing all over griffin rock when concerned citizens notify chief burns its up to the rescue bots to investigate the hauntings are the spirits of the pioneers restless or is there a more scientific explanation,science_fiction
four months after ben returned to his home universe janelle learns that he is the prime suspect in a human trafficking ring and she and interverse agent barclay have five days to find the real culprit or the missing people may be lost forever,science_fiction
having been kidnapped by former pirates because of his ability to whistle up the wind fifteenyearold jamie agrees to help their leader a living corpse find the dragon of windrose island,science_fiction
the death star has been destroyed but the empire isnt going down so easily they are rebuilding the space station and the emperor is madder than ever but while darth vader deals with the return of darth maul its up to heroes luke skywalker princess leia han solo and their friends to travel to naboo save the day and escape from  teenage fangirlspage 4 of cover,science_fiction
elijah and his sister elisha go undercover to investigate a mysterious school that is sheltering runaway teenagers for a sinister purpose,science_fiction
the crew of emergency spaceship em 88 discovers that the mysterious object that they have been sent to investigate is a vehicle for a group of amorphous blobs fleeing from their galaxy,science_fiction
when youre a privateer running a starship is a family business  for tycho hashoone his twin sister yana and their older brother carlo the family business is far from easy  for starters they have to make a living however they can all while dodging pirates and earths dreaded warships  then they have to please the jovian union an alliance of moons that provides the hashoones their letter of marque against earths merchant fleet  but hardest of all the siblings have to impress their mother captain diocletia hashoone who keeps a log of how they perform on every test simulation and mission aboard their family starship the shadow comet  because while the three siblings might be crewers together only one of them will be chosen as the comets next captain  talk about sibling rivalry  part highseas adventure part spaceage epic the jupiter pirates is an unforgettable saga about a solar system on the brink of war and one family caught in the middle of itjacket flapa family of space privateers becomes embroiled in a solar systemwide conspiracy all while the three siblings compete to determine who will become the next captain of the ship when their mother steps down book 1,science_fiction
the readers decisions control the course of an adventure in which two spaceships travel to investigate a black hole,science_fiction
tate archer outruns armed government officials as he tries to keep his now dead fathers strange invention out of the wrong hands alien handstate archer outruns armed government officials as he tries to keep his dead fathers strange invention out of the wrong hands the plot contains profanity and violence the coauthor is sarah fine,science_fiction
it is the year 2049 and humanity is on the brink of extinction tania deeley has always been told that shes a rarity a human child in a world where most children are sophisticated androids manufactured by oxted corporation,science_fiction
the reader may choose the direction of the plot as aliens from outer space arrive on earth purportedly to warn of a terrible disaster,science_fiction
drawn into a computer and out again into an alien spaceship far away from earth the reader must figure out a way to get back home,science_fiction
jake an average suburban kid is confronted one night by a creature from space who teaches him how to morph into the forms of other creatures this fantastic unpredictable edgeofyourseat series can best be described as an xfiles for kidsplus a whole lot more jake rachel cassie tobias and marco are the animorphsfive kids who can change into any animal they touch the bottom of each page is animated with flipbook images so as kids flip pages drawings of each character morph into animals,science_fiction
revered as a hero following the first major defeat of their kurian enemies by rebel forces david valentine now confronts a dangerous enemy at home when he is accused of abusing quisling prisoners the human pawns of the vampire aliens,science_fiction
six junior space rangers try to find a way to defeat the wizards who rule the planet merlina and keep them from gaining control of other planets,science_fiction
cassie believes her strange dreams are just a side effect of having been given the alien power to morph into an animal but when she learns that tobias has been having the same dreams about the ocean they realize someone is issuing a call for help,science_fiction
rachels friend melissa is acting very strange could melissa be one of them rachel plans to enter her friends house as a cat to unlock the secret from within,science_fiction
johns prizewinning essay gets him six days at space camp with wishbone who on the first day there imagines himself as the hero of jack williamsons novel the legion of space who is on a thirtyfirst century outer space rescue mission,science_fiction
a sixteenyearold progidy uses his mentors invention to go into the past to exorcise his unreturned love for a beautiful girl and discovers a mystery involving another of the professors inventions,science_fiction
indepth analysis and discussion of fifteen classic ballantine science fiction titles,science_fiction
discusses the relationship between science and science fiction with examples from literature,science_fiction
cadet kathryn janeway is determined to prove herself at starfleet academy her tough commander etienne mallet demands perfection but kathryns ready for the challenge,science_fiction
swept away to a hidden academy for training budding evil geniuses otto a brilliant orphan wing a sensitive warrior laura a shy computer specialist and shelby an infamous jewel thief plot to beat the odds and escape the prison known as hive,science_fiction
tired of being a boy genius jimmy hooks himself up to his braindrain 8000 machine but his friends try to reverse the process when they see a meteor headed toward retroville,science_fiction
the spaceship was late and when it did land none of the right people were around,science_fiction
hitomi goes searching for a code that could be the key to defeating the robots to prove she should be let on the exoforce team,science_fiction
three teens band together in order to sway the government to repeal all rulings in support of a procedure in which unwanted teenagers are captured and are unwound into parts that can be reused for transplantationproactive citizenry the company that created cam from the parts of unwound teens has a plan to mass produce rewound teens like cam for military purposes and the company has been suppressing technology that could make unwinding completely unnecessary as conner risa and lev uncover these startling secrets enraged teens begin to march on washington to demand justice and a better future but starkeys group of storked teens is growing more powerful and militant with each new recruit and if they have their way theyll burn the harvest camps to the ground and put every adult in them before a firing squad which could destroy any chance america has for a peaceful future,science_fiction
what happens to america when two geeks working from a garage invent easy 3d printing a cure for obesity and crowdsourced theme parks lawsuits against disney are only the beginning in this major novel of the booms busts and further booms in store for america in the age of open source and its herohacker culture,science_fiction
when a cosmetic surgeon is killed in his office with tidy precision detective eve dallas must track down the cunning coldblooded killer who may be one of the doctors beautiful female patients,science_fiction
endowed with an extraordinary power by an ancient african elephant sixteenyearold ashur fine finds himself relying on it as he tries to bring his aunts mugger to justice,science_fiction
in 22ndcentury great britain where climate change has caused vast flooding the piratical reavers kidnap the prime ministers daughter and thirteenyearold lilly melkun an english fishergirl takes her seacat on a daring rescue attempt with a mysterious talking jewel from a past computer age tucked in her belt as ransom,science_fiction
jelly and rich find themselves headed down the sacramento river on an unusual houseboat with a crew from outer space,science_fiction
earth has been destroyed by the drej a race of aliens composed entirely of energy and the human race has scattered throughout the galaxy,science_fiction
on the day of his thirteenth birthday a boy discovers he has esp and that he can exchange extrasensory messages with his dog as well as other animals,science_fiction
based on all six of the star wars movies tells the story of anakin skywalker from his birth in slavery to his death as the powerful darth vader,science_fiction
left behind when the agents leave space city to defend a parallel world from queen misery and her commissars tiny fourthgrader boo who has just completed her training has only her feline companion to help her protect their home world from devious enemies,science_fiction
professor hardwigg his nephew harry and their guide hans explore a volcanic crater in iceland that leads them to the center of the earth and to incredible and horrifying discoveries,science_fiction
eighteenyearold kerra holt a jedi knight on her first mission is left deep in sith space without any support or resources and realizes how unprepared she is but will not abandon the jedis mission to help the colony,science_fiction
kelly and her brother tim accompany their uncle an eccentric computer genius on a dangerous mission using an advanced virtual reality chamber where they must rely not only on logic but on their christian faith to survive,science_fiction
volume 1author indextitle indexseries indexawards indexace and belmont doubles index,science_fiction
