description,genre
as the peaceful coexistence of the avian and serpiente realms becomes increasingly precarious nineteenyearold nicias heir to the ancient and powerful falcon realm learns some lessons about the past that will shape the future of their shared world,fantasy
a highland warrior sworn to protect innocence through the ages black royce is a battle hardened soldier of the gods then he is sent to new york city to protect a healer from those who would use her powers for themselves,fantasy
in the final novel of an original backtoback epic trilogy the human woman darnow queen of the orcsfights for peace in her kingdom against an evil sorcerer bent on her destruction,fantasy
a clever and fearless orphan endures increasing danger while trying to escape from greedy lawless men and elude the terrifying kinderstalksanimals who steal childrenbefore discovering her true destiny,fantasy
when neptune tells emily and her merman father and human mother to return to brightport to try to make merpeople and humans work more closely together emily faces problems with old enemies her new halfmerfolk friend aaron and a mystery related to a group of legendary lost sirens,fantasy
magic candy which causes him to shrink and the help of new animal friends make it possible for a boy called grasshopper to save his mothers cottage from an unscrupulous landlord,fantasy
when the evil baron vengeous escapes from prison detective skulduggery pleasant and his apprentice valkyrie cain have just two days to recapture him or the barons creature the grotesquery may summon the faceless ones back to their world,fantasy
when a minority race of telepaths suspected of causing a neardevastating tidal wave private kaylin neya is summoned to court and into a pr nightmare to ease racial tenisions the emperor has commissioned a play and the playwright has his own ideas who should be the focusp 4 of cover,fantasy
when a roamer trades them an ancient book with only a few pages remaining lina and doon return to ember to seek the machine the book seems to describe in hopes that it will get their new community sparks through the winter,fantasy
twelveyearold max and his allies risk much as they seek to acquire the book of origins an artifact of unimaginable power in hopes of halting the ancient evil that is bringing the world to its knees,fantasy
in order to find his grandfathers lost treasure and save the minimoys arthur and his companions including princess selinia travel into the forbidden city ruled by maltazard the cursed,fantasy
the borrowers a family of miniature people journey down a drain live brefly in a tea kettle and are swept away in a flood before finding a new home  sequel to the borrowers afield,fantasy
a beautiful nightbird takes martha on a magical ride through the night skies,fantasy
drawn by the lodestone his father gave him years before twelveyearold orphan ray travels south meeting along the way various characters from folklore who are battling against an evil industry baron known as the gog,fantasy
seer and slave yim is purchased by honus a warrior whose master has been killed by the followers of an evil god thus entwining their fates together,fantasy
thrown out of her 12th foster home with only a copy of through the lookingglass a 12yearold black girl interchanges the people and situations of her life with those in the book,fantasy
when drawn into the investigation of murders perpetrated on a powerful family in summersea sandy and her student pasco undertake the dangerous mission of entrapping the invisible killers,fantasy
a tiny plumber becomes a hero by rescuing a doll and returning it to its grateful owner,fantasy
brad ellis a serious young american and lucy beale servant at the boarding school where brads father is headmaster find themselves aboard the basset on a fantastical voyage into the realms of imagination,fantasy
dorothy and her friends the tin woodman the scarecrow and jack pumpkinhead travel across oz in search of the young wizard who stole princess ozmaa magic belt,fantasy
helped to escape from her evil guardians by a dodo and a rat tenyearold morag joins her new companions on a dangerous and difficult mission involving a stone dragon the stolen eye of lornish that guards the magical land of marnoch mor and her own unfulfilled destiny and mysterious past,fantasy
fourteenyearold matt forms an uneasy alliance with tuavali the elf and tomtar the troll in an attempt to restore to wellbeing the tree at the northern pole whose roots bind the worlds together while matts nineyearold sister becky tries to free their captive parents with asras help,fantasy
a retelling based on the 1903 operetta of the classic story of how two young people are pursued by the evil barnaby,fantasy
a youngsters search for purity and truth leads him to sharing a communal life with new friends and then back again to the real world,fantasy
a young girl journeys to a faraway place and finds the inner strength to confront the bullies of other worlds and her own,fantasy
when their grumpy cousin bailey bond accidentally creates a window to anywhere anna and carl and their friend ingrid are in for a magical summer of visiting faraway places,fantasy
when destiny mccree wakes up beside a dead man on an oregon beach she knows only this she has to keep moving keep searching and keep one step ahead of the forces that have been pursuing her from the heart of scotland to this isolated spot why the death of her lover has left her alone with little memory of her past a glimmering serpentshaped ring is the one clue she hasand a bargaining chip in a most dangerous gamep 4 of cover,fantasy
as partwolf partvampire guardian riley jenson investigates a series of brutal murders she is torn between the two sides of her nature and between her vampire lover quinn and irritating but handsome bounty hunter kye murphy,fantasy
nomad born and bred demon hunter maxine kiss has always relied upon herself to fight the darkness that surrounds her the predatorshuman zombie and otherwisewho threaten the earth but one man has penetrated her lonely life grant the last of his kind with the ability to manipulate energy he can control any living creature including demons and now his life is in danger haunted by the past determined to change the future maxine soon understands that to save grant she has only one choiceto lose control and release her own powers of darknessp 4 of cover,fantasy
having grown up in a miserable home for abandoned children a young boy jumps at the chance to exchange places with the mysterious flying loblolly boy but once he takes on this new identity he discovers what a harsh price he must pay,fantasy
orphans timothy and verity are cruelly treated by their foster parents before escaping to another world where they are caught up in a struggle against a despicable tyrant and his wicked ally,fantasy
when matt and his family move to a new development they stumble into the middle of massive upheaval in the fairy world and as the elves territory disintegrates and dark factions try to seize control an apprentice mage sees in matt the key to saving the realms from destruction,fantasy
the golden general fights to save ansalon from the forces of the dark queen as the companions fight their own battles,fantasy
john has a great desire to know what it feels like to be something else so he buys himself a magic spell and finds out,fantasy
with their house in foreclosure sisters india and mouse and brother finn are sent to stay with an uncle in colorado until their mother can join them but when the plane lands the children are welcomed by cheering crowds to a strange place where each of them has a perfect house and a clock that is ticking down the time,fantasy
when their farm and everything on it is reduced to miniature by a mysterious machine pete and his grandmother do all they can to keep themselves and their farm from being lost forever,fantasy
while immobilized in a hospital bed janessa journeys into a world of dreamlike adventures with the gods of norse legend,fantasy
on a voyage in the south seas an englishman finds himself shipwrecked in lilliput a land of people only six inches high,fantasy
taking advantage of a severe drought and the longstanding distrust between two tribes the demonic saint dane attempts to take over loors home planet of zadaa opposed once again by the teenaged pendragon and other travelers,fantasy
from the buried glass eye of an ancient teddy bought at a rummage sale grows a strange tree that bears surprising fruit,fantasy
distraught over her fathers death zan wanders into the forest and into a fantasy world where she becomes involved in the orathis fight to save their homeland from invaders,fantasy
the further adventures of maxie pichelsteiner the twoinchtall man begin when he is hired to star in a movie about his own life sequel to the little man,fantasy
during a dangerous journey through the thirteen kingdoms a witch girl and an outcast stableboy find their fortunes intertwined with nefarious agents seeking a powerful spellkey,fantasy
ellys grandmother whisks her away from the human school she was attending and enrolls her in a prestigious fairy academy in the capital of fairydom rainbowville where elly discovers that she might not hate being a fairy after all,fantasy
while her companions continue to pursue kerise and the dragon thane across the desert to retrieve the heart of purespring warrior catriona goodlund awakens in her tomb determined to complete her quest and and return home to face her past,fantasy
evil dark lord tries to recover his dignity his power and his lands when an archfoe transports him to a small town into the body of a thirteenyearold boy,fantasy
the eleven must use their natural skills and highly developed preternatural strengths to stop the spread of evil by the lords of time that is coming in 2012 at the end of the mayan calendar while currently incarnated as deadly handsome men they have the ability to assume their prior formsthose of gigantic dinosaurs one of them ty endeka develops a powerful attraction to his driver kelly maloy she never expects to be drawn into this world of demons vampires werewolves and otherkin but when the elevens mysterious leader fin tells her she has a crucial role to play in the coming fight she joins ty in the war to combat the growing evil,fantasy
leda stowe loves living on her tiny island off the california coast taking care of rescued exotic animals but her peaceful existence is interrupted one night when a gorgeous man with a sword appears out of nowhere in her lions enclosure,fantasy
twelveyearold gregor returns to the world beneath new york city where he joins forces with princess lexa and ripred the rat to defend the underlanders and the nibblers from the army led by the adolescent rat king the bane,fantasy
thirteenyearold alcatraz smedry and his companions seek als father and grandfather in the great library of alexandria where they face undead soulstealing wraiths called the curators of alexandria and one of the scriveners bones a parthuman partmachine mercenary,fantasy
unable to tell friend from enemy orphan number 102 tries to hide the identifying scar on her arm as she evades protectorate soldiers who are trying to return her to the capital and a certain death,fantasy
thea and her friends try to stop an outbreak of a new brand of magic that is attacking students at wandless academy a school supposedly shielded from spells that works through computers which should be impervious to magic,fantasy
as the seventh child born of the union of two seventh children fourteenyearold thea has not fulfilled her parents hope of having special magical powers and they try a last desperate measure before sending her to a school for those with no magical ability,fantasy
the impulsive kerish and his three companions continue their quest for the seven keys needed to save the kingdom of galkis nearing the citadel of the fourth sorcerer saroc,fantasy
when a vicious beast invades his fathers farm and sixteenyearold drew suddenly transforms into a werewolf he runs away from his family seeking refuge in the most out of the way parts of lyssia only to be captured by lord bergans men and forced to battle numerous werecreatures while trying to prove that he is not the enemy,fantasy
timothy  a villain after learning how his powerlessness can be used as a weapon in the world of magic and defeating nicodemuss plan to overthrow the government timothy travels to a wartorn dimension to help the wurm fierce magicians and warriors descended from an ancient dragon race but while covertly gathering information on the ageold feud between the bloodthirsty wurm and the parliament of mages timothy discovers a very different story  one of peaceful wurms and a conspiracy led by the parliament of mages but thats not the only problem on timothys hands the mysterious girl he spotted in skyhaven is the granddaughter of nicodemus and shes challenging leanders right to be grandmaster of the order of alhazred and despite nicodemuss death mages are still disappearingand this time someone is painting timothy as the villain,fantasy
a poor woodcutters children abandoned in the woods by their father and stepmother come upon a gingerbread house inhabited by a witch who likes to eat children,fantasy
tom must face the winged flame a phoenix living inside a volcano to finish his quest to save the kingdom from the dark wizard malvel but during the fight he learns about his mysterious past and what it means for his future,fantasy
when dewberry and her fairy friends go in search of the lost chest of paragon which is rumored to contain a great gift of knowledge for all of mankind the results of their discovery are far from what they expected,fantasy
when the angel ebol comes down to the land of korasan to help the foresters sixteenyearold daughter lydia he finds himself involved in romance political intrigues and other escapades,fantasy
when the prince of darkness sends a dragon to steal king orics gold the mighty warrior flare comes to the rescue,fantasy
neva and ivo emerge from an enchanted place in the forest to meet many dangers right a great wrong and hopefully bring peace to two warring kingdoms,fantasy
once in a cottage above the cliffs on the dark sea of darkness there lived three children and their trusty dog nugget janner igiby his brother tink their crippled sister leeli are gifted children as all children are loved well by a noble mother and expirate grandfather but they will need all their gifts and all that love to survive the evil pursuit of the venomous fangs of dang who have crossed the dark sea to rule the land with malice and pursue the igibys who hold the secret to the lost legend and jewels of good king wingfeather of the shining isle of anniera,fantasy
magiere the dhampir thinks that her nights of hunting vampires are over after settling down in her newly adopted village of miiskanow vampire free thanks to her and he half elf partner leesilshe looks forward to quiet days tending to her tavernbut far away in the capital city of bela a prominent councilmans daughter has been found dead on her own doorstep  and all signs point to a vampire knowing that the battered and burned village of miiska could use an infusion of cash belas town council offers a generous bounty to the dhampir if she will slay their vampire  magiere resists wanting nothing more than to forget her past and ignore her half vampire nature  only leesil can persuade magiere to follow her destinybefore more innocents are claimed by darkness,fantasy
spunky teen madison though technically dead uses a stolen amulet to retain the illusion of a body and help her in the struggle between light and dark reapers,fantasy
another marvelous tale of passion and otherworldly occurrences centered around the mysterious dirk and steele detective agencyas a tormented young woman with the precognitive power to foresee terrible futures must place her own fate in the hands of a mesmerizing prince of the sea,fantasy
in the wake of their adventure in china captain will laurence of his majestys aerial corps and his dragon temeraire are sent on a mission to protect three valuable dragon eggs on a trip back to england from the ottoman empire but the vengeful chinese dragon lien allies herself with napoleon to stop them,fantasy
with his dying words the opal emperor leaves brophy the heir of autumn with an impossible choice betray his heart by seducing the enchantress arefaine morgeon or watch her ruthless ambitions destroy the worldpublisher,fantasy
four years after vanquishing odoursin and saving humankind from his evil plans sam and skipper return to a devastated aurobon where they must once again fight for survival against the reemerged odoursin and his new army of robber flies,fantasy
follows the adventures of two royal teenagers who possess extraordinary mental powers,fantasy
nick wishes for some pink mail addressed just to him and his sister helps make it happen,fantasy
join mr fantastic the invisible woman the human torch and the thing for a wild ride of allnew unforgettable exploits,fantasy
when joes team is in the running for the basketball playoffs wishbone is reminded not to judge people by size as he imagines himself as the seventeenthcentury traveler lemuel gulliver whose adventures included visits to lilliput where people are six inches tall and brobdingnag a land peopled by giants,fantasy
presents sixteen short stories of fantasy the supernatural and the macabre,fantasy
a classic novel of the future follows the time traveller as he hurtles one million years into the future and encounters a world populated by two distinct races the childlike eloi and the disgusting morlocks who prey on the eloi,fantasy
when young king einon betrays sir bowens teachings bowen teams up with a rebel a traveling bard and a wise dragon to save the kingdom from destruction,fantasy
bobby and the traveler from cloralspaderhave flumed to new york city 1937 against a backdrop of gangsters swing music and the distant sound of a brewing war the two must uncover the evil saint danes newest plot,fantasy
when colleen and ikutu contrive to get to know the mysterious new transfer student hiroto they signed up for much more than they bargained for hiroto is a prince from another dimension running from his evil uncle lord kumagai and his soldiers now colleen ikutu and genius alvin must travel through space and time with hiroto in order to escape,fantasy
strangely attracted to an antique doll twelveyearold twins buy the toy and soon find themselves haunted by powerful and tragic memories of ancestral twins who had also been owners of the doll,fantasy
addicted to an enchantment that turns pain into pleasure and bound by oaths he refuses to abandonvalen a rebellious sorcerer risks body and soul to rescue one child seek justice for another and bring a dying land its rightful kingfrom publisher description,fantasy
with their viking father off at sea and their mother carried off by a huge bird two viking children face the dangers of caring for a baby giant,fantasy
a poor farmer undertakes a mission to find safety for a baby destined to be a great queen but now in danger from an evil sorceress,fantasy
having survived his first mission as mask wearer amos daragon finds himself on his way to the city of the dead trying to find the key that will unlock the doors to paradise and hell,fantasy
charlemagne must overcome his kingdoms internal problems and defeat an invasion from bellorum,fantasy
a boy and his sister separated from their boat come ashore on a pacific island inhabited by a race of people with a radically different conception of birth aging and death,fantasy
complete dreamwork course for both individuals and groups using over 35 methods to actualize dreams and experience their meanings based on both the jungian journey towards individuation and wholeness and the idea of altering the dream state attributed to the senoi people of malaya these techniques renew and transform our inner and outer worlds into a state of harmonious wholeness,fantasy
helped by a very long ladder some unusual acquaintances two rather worried parents and a great deal of community spirit a young english boy makes an astonishing discovery when he embarks on a mission to prove that the moon is nothing but a big hole in the sky,fantasy
sylvie bartrams beloved dog mr jackson has lost his bark the birds have stopped singing and in the growing silence her dad has disappeared determined to find him sylvie and her best friend kiteflying tone deaf george are drawn into the nightmare world of the songman a world haunted by the terrifying woodpecker man in his swanpowered balloon a world where nothing can sing and no one can speak only sylvie can save the earth from its terrible voiceless fatedust jacket,fantasy
more adventures with elizabeth who can grow small enough to join her four dolls in their doll house here the duke of cranberry supposedly the father of one of the dolls arrives for a visit,fantasy
when snorlax gets hungry no pokmon is safe,fantasy
when a flood threatens the town maxwell finds help in an unlikely place,fantasy
bearing six unusual gifts young prince jen embarks on a perilous quest and emerges triumphantly into manhood,fantasy
when dragonite helps santa deliver presents to the children they have to be very quiet so they dont wake them,fantasy
after seeing the pokmon movie a young boy is amazed to discover that he has turned into the star,fantasy
butterfree surprises everyone by braving a fierce storm to rescue a town of sick pokmon,fantasy
a shy friendless little girl seeks refuge with the friendly occupants of octagon house a strange eightsided house believed to be inhabited by a witch,fantasy
while attending an elite prep school where their father is a professor wendy and john darling discover a book which opens the door to other worlds to egyptian myths long thought impossible and to the home of an ageold darkness,fantasy
frankie stein was created in a laboratory and when she enters merston high school camouflaged as a normie all she wants is to fit in but it takes the help of another new student who believes that everyone should be treated equally before frankie even has a chance,fantasy
this ultimate unofficial guide has what fans crave  secrets revealed  instructions on how to find clues  recent hints and information from jk rowlings chats and interviews  brief summaries of the mysteries for each of the first four books  tons of great harry potter info this guide is a musthave to keep the ultimate harry potter fan busy while waiting for book 5,fantasy
when the jesters son sings for the sad common people his songs turn into beautiful pictures in the air which bring happiness but when he sings for the contented selfcentered king and noblemen his songs turn into pictures of great sadness,fantasy
trouble comes to the kingdom of gepeth in the form of a flying giant the appearance of forbidden snow a tornado and the loss of princess lenoras extraordinary mental powers,fantasy
lila travels to another world to try to save her inheritance and her father from terrifying creatures and an evil sorceress,fantasy
six years ago eden fleming discovered her fianc was a woodland spirit who needed an heir to end the exile imposed on him devastated eden fled and married another awakened from a fiveyear sleep lord hern is informed that eden has returned with the boy hed been told was dead vowing vengeance hern assumes the identity of a servant but soon his heart casts off the hate and he becomes devoted to the woman he vowed to destroy,fantasy
key words in quotations from the pooh books introduce the letters of the alphabet and the pooh philosophy,fantasy
when rob puts the rare fossil of a coiled snake he has discovered under the warm radiator in his room a wonderful thing happens,fantasy
a sea triton hatches from a special eggshaped stone to both the expectation and amazement of two little english school boys on holiday at the coast,fantasy
ash misty brock and pikachu are hiking in the mountains when a blizzard strikes ash must use his skill as a pokmon trainer to help them survive the night,fantasy
a caterpillar turns into a monarch butterfly and finds that the gypsy frogs prediction has come true and he cannot find the lady of his choice,fantasy
something strange and terrible has beeen happening in nuworld where some of goels most trusted servants have disappeared,fantasy
having been hired by a mysterious corporation called gippart twelveyearold joshalong with two friends and the ghost of his dead twin sisterfinds himself trapped in umaya a place between dreams time and reality,fantasy
in an attempt to find out for their king what happiness is two pigs on separate islands experiment with what each considers his ideal way of life and each has very different results,fantasy
the unicorn helped noah loal all the animals but as there was no room for him aboard the ark he was towed behind in a life preserverand became a narwhale by the end of the voyage,fantasy
the doll susie cuts out of paper becomes not only disagreeable but difficult to manage,fantasy
a young man becomes the unwilling shepherd the ceremonial link between the god and his people,fantasy
after her children grew up the old woman who lived in a shoe went away leaving six animals behind in the shoe they go together in search of a new home and find one with another old woman who has a house just like the one they left,fantasy
