description,genre
pulitzerprizewinning story of the manners and morals of new york society in the later 1800s focusing on a handsome young lawyer who cannot decide between passion and propriety in his women,romance
mormon elders in the town of cottonwoods pressure the widow jane withersteen to remarry so that her lands and herds will remain in their control gradually they frighten away most of her cowboys and rustlers steal away her cattle but the gunfighter lassiter stands by her as the inevitable confrontation draws near,romance
intelligent practical mary challoner knew wicked dominic alastair marquis of vidal wouldnt marry her sister despite her mothers matchmaking schemes so mary coolly prepared to protect her sister by deceiving vidal but she certainly hadnt expected the infuriated nobleman to kidnap her reluctantly awakening to his responsibilityand realizing just how serious mary was about her virtuevidal proposed marriage  but after all the carefully laid wedding plots hed dodged vidal had never expected to be refused by a chit baffled bewitched and frustratingly tempted vidal swore that mary would be his wife even if it was the last thing either of them ever didp 4 of cover,romance
when jenner redwine wins the lottery she never imagined how much it would cost her  luckily she finds an allyand a guide to the rarefied realm of privilege in a shy kindhearted heiress who invites jenner on a charity cruise  but what should have been a love boat cruise suddenly turns into a game of dizzying intrigue and harrowing danger and jenner finds herself taken hostage by a menacing strangera stranger that helps her rediscover feelings she hasnt had in years  now if she can only survive to live a life worth living ,romance
a young woman brought up in a brahmin family boston elite members of bostons traditional old upper class on beacon hill falls in love with a man from a very different background and the destiny of a conservative bostonian couple is changed by italian irish and jewish law partners,romance
he has stolen her past but mackayla will never allow her sisters murderer to take her future yet even the uniquely gifted sidheseer is no match for the lord master who has unleashed an insatiable sexual craving that consumes macs every thought  and thrusts her into the seductive realm of two very dangerous men both of whom she desires but dares not trust as the enigmatic jericho barrons and the sensual fae prince vlane vie for her body and soul as cryptic entries from her sisters diary mysteriously appear and the power of the dark book weaves its annihilating path through the city macs greatest enemy delivers a final challenge  its an invitation mac cannot refuse one that sends her racing home to georgia where an even darker threat awaits with her parents missing and the lives of her loved ones under siege mac is about to come facetoface with a soulshattering truthabout herself and her sister about jericho barrons and about the world she thought she knew,romance
barbara holloway becomes the prime suspect in a highprofile kidnapping case involving a young boy the grandson of a wealthy family who accuses barbara of aiding in his disappearance,romance
a young woman in 1970s arkansas is charmed by the owner of a fishing camp but is wary of his potential connections to several local crimesprovided by the publisher,romance
resisting romantic commitments while enjoying a life of boating swimming and barbecues travis parker is unable to deny his attraction to new neighbor gabby holland a defensive woman whose longtime boyfriend further challenges travis growing feelings,romance
returning to london after her tenmonth honeymoon becky bloomwood brandon finds herself depressed by a lack of money a search for a job and her best friend suzes new best friend until she discovers that she has a long lost sister,romance
evangeline shaw is the key to the conspiracy that threatens robert cannons company classified software developed by cannons group is being sold to a foreign government without his approval it isnt just theft or a case of corporate espionage  its treason and the trail leads straight to shaw  who by all accounts has both the means and the motivesdetermined to handle his own investigation cannon tracks her to a small town in alabama but as he tries to untangle the knot that surrounds her he finds himself questioning hes believed the facts still seem pretty blackandbut his heart tells him shes no mata hari,romance
four nuns forced to flee their spanish convent find themselves pawns in a violent struggle between the outlawed basque movement and the spanish army,romance
a novel of one woman who helped convince sherman that war was hellfrcvr,romance
when gothgirl raven follows her vampire boyfriend to hipsterville she discovers a dangerous secret club inhabited by vampires who are feuding over its leadership,romance
stories about eight young women who have grit and humor in dealing with their problems,romance
set in 1930s louisiana a young woman makes a new life for herself after she runs away from homeprovided by publisher,romance
a year ago archaeologist leslie macintyre barely survived the explosion that took the life of her fianc matt connolly in the long months since shes slowly come to terms not only with her loss but with her unsettling new ability to communicate with ghosts a dubious gift received in the wake of her own brush with death now shes returned to manhattans historic hastings house site of the explosion to conquer her fears and investigate a newly discovered burial ground in this place restless spirits hold the secrets not only of past injustice but of a very real contemporary conspiracy with deadly designs on the citys womenincluding leslie herself as she is drawn closer to the darkness at the heart of hastings house she must ultimately face the power of an evil mind alone in a place where not even the men she loves can save herfrom publisher description,romance
on the island of malta during world war ii british nurse lila cunningham awaits the return of her love a british soldier of noble birth but will he marry a woman below his rank meanwhile a native maltese teacher pines for her,romance
when the production of a hollywood film in baltimore brings mayhem and murder to the area private investigator tess monaghan finds her job complicated by the acting skills of her numerous suspects,romance
sixteenyearold raven a vampireobsessed goth girl searches for her true love alexander who she has learned is a real vampire,romance
libby brown finds the help of her cowboy neighbor luke rawlins invaluable as she tries to make the transition from big city journalist to chicken farmer but when the pair gets embroiled in a local crime they find their growing attraction proves only to complicate their lives,romance
payton kendall and jd jameson are lawyers who know the meaning of objection a feminist to the bone payton has fought hard to succeed in a profession dominated by men born wealthy privileged and cocky jd  has fought hard to ignore her facetoface they are perfectly civil they have to be for eight years they have kept a safe distance and tolerated each other as coworkers for one reason only to make partner at the firm but all bets are off when theyre asked to join forces on a major casep4 of cover,romance
laurel bancroft has lived for years like a recluse isolating herself from a town that has branded her a murderer but now convinced people have finally forgotten she is ready to resume her life then laurel meets alec stanton hired to help her redesign her garden alec is a stranger with a mysterious past though more than ten years younger alec is exactly what laurel needs intelligent talented passionate but as their relationship grow so does a dangerous threat against them someone wants laurel to return to her seclusion and give up her younger loversomeone who hasnt forgotten that night so many years ago,romance
celinas brother challenges new orleanss most infamous swordsman to a duel in order to save her brother from certain death celina confronts his opponent rio de silva he agrees to spare her brother but his price is celinas innocence,romance
a former knight templar who had been betrayed and killed derek de molay has spent eternity battling the dark angels of hell until he is sent back to the mortal realm to protect rachel duncan from the darkness that surrounds her and to save the mortal souls of all humankind,romance
an expert matchmaker but unable to find her own husband lady francesca haughston decides to help the duke of rochford who broke her heart years earlier find the perfect wife which leads to a temptation that could result in scandal,romance
former fbi special agent sloane burbank survived a lifethreatening injury sustained in the line of duty only to face leaving a job she loves in order to recuperate as an independent consultant she now uses her specialized skills to train law enforcement and private organizations in crisis resolution but when one of her closest childhood friends mysteriously disappears and the womans parents beg for her help sloane takes the caseeven though her exlover derek parker is the fbi agent in charge,romance
on a welldeserved vacation from her fasttrack job as a lawyer samantha willan is looking forward to hanging out with her sisters at their familys cottage rogue hunter garrett mortimer has been sent by the council to search for an errant vampire who has been biting mortals when the two cross paths in the middle of nowhere romance intrudes on sams rr and garretts mission,romance
gorgeous successful executive teri stewart spends her days working for las hottest record companyand her nights all alone her best friend nicole is determined to find teri a man but she hasnt had much luck because teri wants more than mr maybe shes holding out for mr right and wont settle for anything less just when teri is ready to give up a man from her past returns to reignite their romance with his sultry smile and easygoing charm radio dj harrison starr is oneofa kindand teri cant deny shes fallen hard for him again with her life finally falling into place teri thinks her dreams might come true after all but harrison may have a secret that could change everythingp 4 of cover,romance
an enigmatic sexy sixhundredyearold vampire risks everything to protect the woman he loves when the irresistible ivy dearing the daughter of the infamous madame of the notorious london brothel maison rouge enlists his aid to help her find the evil killer responsible for the deaths of two of her friends,romance
determined to resist the seductive attention of the marquess of claybourne lilian loring decides to hide from her suitor in a house of scandalous repute where she spends her time instructing the demimonde in the art of deportment and manners,romance
a oujia board summons the spirit of detective beau kidd who wants to clear his name in the interstatekiller murders christina hardy must convince jett braden a copturnedwriter that she holds the key to catching the real killer,romance
while in salem massachusetts looking for his friends wife who mysteriously vanished cop jeremy flynn is drawn into a murder investigation involving the infamous harvest man and teams up with a local occult expert who disagrees with his methods,romance
after arriving in america as an irish nurse banshee caer donahue yearns for a mortal life when she is submerged in a mystery of sunken treasure and attempted murder which leads her into the loving arms of zach flynn,romance
a oujia board summons the spirit of detective beau kidd who wants to clear his name in the interstatekiller murders christina hardy must convince jett braden a copturnedwriter that she holds the key to catching the real killer,romance
an enigmatic sexy sixhundredyearold vampire risks everything to protect the woman he loves when the irresistible ivy dearing the daughter of the infamous madame of the notorious london brothel maison rouge enlists his aid to help her find the evil killer responsible for the deaths of two of her friends,romance
an expert matchmaker but unable to find her own husband lady francesca haughston decides to help the duke of rochford who broke her heart years earlier find the perfect wife which leads to a temptation that could result in scandal,romance
payton kendall and jd jameson are lawyers who know the meaning of objection a feminist to the bone payton has fought hard to succeed in a profession dominated by men born wealthy privileged and cocky jd  has fought hard to ignore her facetoface they are perfectly civil they have to be for eight years they have kept a safe distance and tolerated each other as coworkers for one reason only to make partner at the firm but all bets are off when theyre asked to join forces on a major casep4 of cover,romance
celinas brother challenges new orleanss most infamous swordsman to a duel in order to save her brother from certain death celina confronts his opponent rio de silva he agrees to spare her brother but his price is celinas innocence,romance
gorgeous successful executive teri stewart spends her days working for las hottest record companyand her nights all alone her best friend nicole is determined to find teri a man but she hasnt had much luck because teri wants more than mr maybe shes holding out for mr right and wont settle for anything less just when teri is ready to give up a man from her past returns to reignite their romance with his sultry smile and easygoing charm radio dj harrison starr is oneofa kindand teri cant deny shes fallen hard for him again with her life finally falling into place teri thinks her dreams might come true after all but harrison may have a secret that could change everythingp 4 of cover,romance
determined to resist the seductive attention of the marquess of claybourne lilian loring decides to hide from her suitor in a house of scandalous repute where she spends her time instructing the demimonde in the art of deportment and manners,romance
a hardened battleweary warrior reynaud has forgotten what it is to be in the company of a beautiful woman to delight in her comfort and warmth on his return to granada he is drawn to leonor and senses that she could heal his hidden scars she is set upon a dangerous path a path that they travel together becoming closer every day  every night but such forbidden passion may be their undoing,romance
to restore family honor the marquess of rotherstone faces his most dangerous missionfinding the perfect bride to londons aristocracy the inferno club is a scandalous society of men no proper young lady would acknowledge but though they are publicly notorious for pursuing all manner of debauchery in private they are warriors who would do anything to protect king and country the marquess of rotherstone has decided its time to restore the familys good name but as a member of the inferno club he knows there is only one way to redeem himself in societys eyes marry a lady of impeccable beauty and breeding whose reputation is above all spotless someone quite unlike daphne starling true shes temptingly lovely but a jilted suitor has nearly ruined her reputation still max cannot resist her allureor the challenge of proving londons gossips wrong he would do anything to win her hand and show that even a wicked marquess can make a perfect husband  from publishers web site,romance
twelve years have passed since teenagers sheridan kohl and jason wyatt were shot by an unknown assailant in whiterock tennessee sheridan survived but the shooter was never captured now a new development in the case brings sheridan back to whiterock but someone doesnt want her to come home,romance
marco salzano is furious one moment of passion in the sultry heat of carnaval has had its price burning with suspicion and anger the arrogant venezuelan is going to track down his errant onenight stand and claim his love child but hes accusing the wrong woman pretending to be her sister fragile amber convinces marco that the baby in question is not his but when marco discovers her deception he vows to take ambernot as his mistress but as his bridep 4 of cover,romance
haunted by a terrible secret dr jama keith returns to her hometown of river dance missouri after the young niece of her former fianc terell mercer is abducted the search puts terell and jama in peril,romance
seven years ago private investigator rafe diaz went to prison for a crime he didnt commitand allie fieldings testimony helped put him there now the popular socialite holds his clients fate in her manicured hands but this time the charge is murder one and rafe intends to question allie until that glossy mouth of hers tells the truth shooting daggers from those smoldering eyes rafe could easily pass for the bad guy allie once thought he was but now her onetime enemy is the only man who can protect her because a coldblooded murderer wants to ensure she never gets another day on the witness standp4 of cover,romance
natalie coleman returns to the mississippi home she ran from years ago to get some muchneeded comfort and advice from her grandmother big mama who helps her confront the painful events of her past and get her life back on track,romance
it was just one simple mission  find out whether a winemaker in argentina was a new york millionaires longlost son but susannah clarke quickly learned amado alvarez played by his own rules hed give her the dna sample she wanted  if she spent the night with him and in a moment of madness shed given in to his demand and to her own desire now she had to return to south america to face this compelling sensuous man again  and to face this compelling sensuous man again  and to face the consequences of that one unforgotten unforgettable night in a strangers bed ,romance
lucie evans wants a fresh start and the chance to show exboss sawyer mcnamara that she no longer craves absolution for a crime she didnt commit so when shes offered a trip to south america as the personal bodyguard to a billionaire heiress lucie jumps at the prospect but then shes kidnapped in a case of mistaken identity and her only hope of survival rests with the one man she never wanted to see again,romance
she prefers guns to gownsand riding the land to dancing at balls so heiress gabrielle price heads across texass most dangerous territory to break her unwanted society engagement only her biggest problem isnt outlaws and killers its a rugged relentless texas ranger with a killer to catch hudson stone has better things to do than escort his commanders spoiled socialite daughter but his fiery charge is as irresistible as she is offlimits and to protect her hell risk his reputation his lifeand his heartp 4 cover,romance
to gain access to the secrets of a legendary alchemist romes vampires have allied themselves with creatures as evil and bloodthirsty as they are the new leader of the citys vampire hunterslady victoria gardella grantworth de lacyreluctantly turns to the enigmatic sebastian vioget for help just as maximilian pesaro arrives to aid his fellow slayers no matter what the sacrifice desire puts her at the mercy of sebastian while loyalty binds her to max but she does not know if she can trust either especially when a seductive vampire begins luring her into the shadowsfrom publisher description,romance
tate winslow is done with all the guns the adventures the brushes with death all she wants is to be left alone so when her enigmatic exboss shows up on her doorstep barely alive she really tries not to care hes all alpha male the baddest of the bad  and a threat to her hardwon peace in more ways than one tate is the only lead derek cole has on a case that could blow the intelligence world apart  if it doesnt kill him before he can figure it out she was his best agent but shes in hiding and hes gone rogue and hes starting to think of her in a very nonprofessional way in fact he wants tate like he wants his next breath but hes already risking his life and his careerdoes he need to put his heart in danger toop 4 of cover,romance
blackmailed in the billionaires beda golddigging homewrecker isnt curt mcintoshs ideal woman but it seems thats exactly what hes got with peta grey for curt there is only one way to stop herblackmailin reality peta is a penniless virgin trying to survive she accepts curts ultimatum and agrees to act as his mistress but the terms of the deal arent clear peta thought their relationship was purely businessso why has she just woken up naked in curts bed,romance
after escaping from the otherworld crime unit kellen falcon came to nouveau monde to crack a rare blood disease  but the european hotbed of temptation yielded sport no vampire could resistcriminologist sophie st clair  and with only days to live kellen sought sweet release from her to escape a savage past  the lycan beauty wasnt one to stray from her pact  but an investigation into a downtown bombing now tied the two together  and it wasnt long before kellens smoldering eyes and sophies fierce desire for this vampire put her loyalties to the testcover verso,romance
quade westmorelands onenight love affair with cheyenne had branded him body and soul but hed never even learned her last name almost a year later driven by memories and one incriminating photo the sexy operative had finally tracked her downand discovered three little babies bearing his features learning he was a father made quade even more determined he would claim cheyenne steele in every way shockingly the irresistible beauty seemed intent on resisting him but the westmoreland destiny was at stake and quade would fight for what was hisp 4 of cover,romance
desperate to escape her past miss journey smith heads deep into montana territory then a terrible accident strands her in the tiny town of walten during the christmas season the townspeople welcome journey into their hearts and homes leading her to dream of a normal life full of happiness holidaysand the towns handsome parson enchanted by the troubled beauty zane thompson knows journey is not what she seems but she cantor wonttrust him with her secrets especially when her past reappears with a vengeance soon the parson must risk his life and his faith to offer journey the greatest christmas gift of allhis heart,romance
when former air force combat controller dallas ohalloran is teamed up with gorgeous jag officer julianne decatur to investigate a navy flyers apparent suicide their mission takes a dangerous turn as they succumb to temptation,romance
the seven sinclair brothers and sisters live for scandal and delight in disgraceuntil their father decrees that they must reform propriety has never come easily but now they have no choice,romance
it seems completely unfair that a shedemon whose purpose is seduction cant get hot and heavy with the one mortal who knows and accepts her for what she is,romance
no ones ever seen it everybody wants it thats why the government has just unleashed its secret weapon dropdeadgrogeous art dealer suzi toussi has been tapped for the toughest mission of her career to locate the memphis sphinx an ancient artifact rumored to possess otherworldly powers tracking it to paraguay means going up against dax killian the sexy special ops agent whos planning to snatch the coveted relic right out of her hot little hands if he can find it first dax first spotted her outside a seedy barin threeinch heels and a tootight dress hed know those curves anywhere but what was suzi doing in a hellhole like ciudad del este dax knows the answer the sphinx suddenly the game is onand only one of them will walk away with the prize with the sphinx surfacing and passion taking suzi and dax under theyre headed for a showdown that could reveal the secrets of the agesor expose them to the hottest danger of allp 4 of cover,romance
raised by her widowed father jolie russell can keep up with any manuntil sexy land developer cody dean struts into her life cody buys the russell farm then relocates jolie and her dad to the copper creek estates where two worlds soon collide,romance
the selfish sensual demon maksim falls for the one woman who can resist him and their erotic couplings result in complications the suspense of the subplot concerning jos dead sister comes to naught and maksims search for his sister is too easily concluded,romance
story of a pastor with a broken spirit who must confront his lack of faith before he can be wholeprovided by the publisher,romance
libby vincent wants to tell romano vincenzo why she allowed his ruthless family to take her baby from her but the darkhearted billionaire isnt in the mood for listening he needs libby back in his life and he knows she will do anything to see her child even marry her most bitter enemy hell take her as his bride but romano doesnt do lovep 4 of cover,romance
when her tall dark delicious husband joins their three kids in calling her mom karol simons has an identity crisis sure she loves the pintsized trio but whats happened to her dreams of writing a novel determined to have it all she jumps on her husbands offer to take over as mom for three weeks neighbor dyanne has baby fever but didnt expect to get motherhood practice on her neighbors three rambunctious children yet after seeing the kids father so in over his head the career woman trades her glamorous clothes and fourinch heels for the playground and potty training she hopes to convince her reluctant husband they should start a family of their own right away everyones in for some big surprisesp 4 of cover,romance
