description,genre
in england after a major disaster has reduced the population to a few thousand three young people flee a regimented community in search of freedom,science_fiction
in an overcrowded future earths surplus population is dispersed throughout history but the system that makes this possible is about to collapse with deadly consequences,science_fiction
while at a resort on a vacation trip his uncle won zack begins wondering if his cousin has been telling the truth for yearsthat he really is an alien prince sent to earth for protection and who is now being chased by enemy aliens disguised as bald fat men,science_fiction
andrew and gemma find a story written by a chicken describing how she has seen little green men come down from space with a plan to roast and eat the people of earth,science_fiction
cathy an aspiring artist who is still getting over her fathers death becomes embroiled in a mystery after discovering that her exboyfriendwho appears only a few years older than herselfis actually more than two hundred years old,science_fiction
released from quarantine upon earths discovery of the alien skink threat lieutenant bass and his men of the 34th fist unit struggle with internal limitations while planning to locate and invade the skink home world,science_fiction
as an earth inspector charged with solving the riddle of why there is an eye on a pyramid on the back of the one dollar bill the reader travels from new york to hawaii and encounters federal agents seeking an extraterrestrial,science_fiction
when a pair of ufowatchers disguised as aliens tries to get inside the intergalactic bed  breakfast to broadcast their findings it is up to david and amy to keep the imposters at bay,science_fiction
babar and his family are kidnapped and taken to a strange planet,science_fiction
upon suddenly learning that her parents are researchers from another planet and they must leave in seven days or risk discovery twelveyearold nesta decides to stay in their york england home whether or not her parents go,science_fiction
rebels assist princess leia in breaking free from an evil empire which is controlling the galaxy,science_fiction
after finding that new mungo is not the refuge they sought mara leaving fox behind again sets out to sea with a ship full of refugees and with the help of the gipsea boy tuck tries to find land at the top of the world that will be safe from storms and rising water,science_fiction
when robots from all over zone one gather to race in the digimaze a power pack mixup almost causes disaster for sol1,science_fiction
aldrea a young member of the outpost the andalite race has placed on the planet of the horkbajir must help her native friend dak when the ruthless parasitic yeerks try to enslave his people,science_fiction
while the villainous trioculus plots to steal away princess leia from han solo and make her his dark queen jabba the hutts father zorba prepares to avenge the death of his son at leias hand,science_fiction
having landed at the evil scientist gogs headquarters on the deserted planet kiva to make sure that his project starscream has been destroyed zak and tash find strange shadow creatures and hidden danger,science_fiction
when a colonist from a forgotten artificial moon returns to earth thirteenyearold merry and her grandfather must battle to save their culture from the visitors strange powers,science_fiction
having traced a dimensional rift to jerusalem in 583 bce darpa sends thirteenyearold eli and his friends into the past to try to prevent the unraveling of history and the spread of the deadly slow pox,science_fiction
the inhabitants of the secluded valley believe life has always been as they know it until strangers arrive who lend threatening reality to the tales of an elder about life before the devastating upheaval,science_fiction
three teenagers are going on the trip of a lifetime only one is coming back its been more than forty years since nasa sent the first men to the moon and to grab some muchneeded funding and attention they decide to launch an historic international lottery in which three lucky teenagers can win a weeklong trip to moon base darlah 2a place that no one but top government officials even knew existed until now the three winners antoine midori and mia come from all over the world but just before the scheduled launch the teenagers each experience strange inexplicable events little do they know that there was a reason nasa never sent anyone back there until nowa sinister reason but the countdown has already begun ,science_fiction
after a brutal fifteenyear war for survival the coalition of ordered governments is forced to destroy mankinds only remaining city in a final bid to stop the locust horde as the survivors flee jacinto they must contend with the last of the locust bent on vengeance as they struggle to stay alive in an icy wilderness marcus fenix dom santiago and their fellow gears fight to get jacintos refugees to a safe haven but find themselves in a lawless new world where the enemy is humanand as desperate and dangerous as any locustp4 of cover,science_fiction
when he learns that he and his father must soon leave earth elevenyearold thomas derwent is upset but a terrible accident that separates the two of them makes thomass situation much worse,science_fiction
having escaped extermination when ruthless invaders colonized his planet a space traveler wanders for many years and then returns to claim his world changing the lives of seventeenyearold maran and her friends,science_fiction
a mysterious prophecy continues to transform the face of europe as christianity and islam battle for supremacy across spain agents from the future use horrific weapons of destruction to change history and in 1492 a bold explorer seeks funding for his western expedition,science_fiction
as the students at her school become increasingly caught up in the annual game of elimination zoe grows more and more convinced that the new girl in her eighth grade class is not what she seems,science_fiction
after his father begins working for the mysterious eden corporation and forcibly relocates the family to the village of paradise teenage jack uncovers a sinister plot that threatens to destroy them all,science_fiction
fourteenyearold brenton questions the choices in his life when an alien anthropologist arrives to study an ancient aboriginal tribe that once lived in the area around his home,science_fiction
three tales of science fiction how it was when the past went away the eve of rumoko we all die naked,science_fiction
living in a time when people are the servants of automobiles and ruled by the master auto of the planet josette longs to leave her rollabout and try her legs,science_fiction
in his second adventure matterhorn finds himself transported by the maker 13000 years into the past and along with aaron the baron princess jewels and nate the great must find the talis that the sasquatch are guarding,science_fiction
discovering that the yeerks possess a weapon that can transform an animorph back to a normal person with the flick of a switch the animorphs are forced to find a way to destroy their secret tool quickly or risk having their secret identitites exposed to all,science_fiction
when players of their virtual reality computer game fall into a coma liz and bj oconnor teenage owners of a computer games company flee from the police in an attempt to locate a copy of their game and correct the programming,science_fiction
a band of children must scavenge to survive in a postapocalyptic future where forbidden territories exist and the line between man and beast is blurred,science_fiction
an alien family lands on earth and a human family is taken on the ride of their lives in a transport operated by a talking computer,science_fiction
a beautiful and remote village girl follows luke when he leaves for london to work with the inventor of a revolutionary time machine,science_fiction
in a fardistant solar system lieutenant joel gilmore and his space observation team are suddenly attacked by the very aliens they were sent to watch,science_fiction
when her annoying older sister gets a bit part in a movie fourteenyearold jet and her family travel to ollywoodthe movie capital of their earthlike planetwhere on a trip through the citys subways jet and her robot dog otis are transported to a world of rejected fantasy and science fiction movies and must try to find their way back to reality,science_fiction
when their family moves into a house at the edge of a forest two sisters sense an invisible presence as strange occurrences take place,science_fiction
scientists of 1987 are forced to determine whether their time machine previously used only for historical research can also be used to alter history both past and future,science_fiction
max finds himself in possession of a time travel device which is eagerly sought by two desperate men the scientist who invented it and the scientists alter ego from a different timeline,science_fiction
when he rebels against the tyranny of the ruling scholars noren a village boy is labeled a heretic and sent to them for punishment,science_fiction
when refugees from a warravaged earth first settled harmony they built a master computer as a guardian of the peacea machine designed to keep people from developing the technology that devastated their old world their descendants genetically altered to receive the computers transmissions worshiped its voice withinwhat they called the oversoul but after 40 million years the oversoul began breaking down to be repaired its core had to interface with the even more powerful master computer still on earth,science_fiction
two new zealand teenagers receive a desperate sos from their future selves and set out on a quest to stop an impending ecological disaster that could mean the end of humanity,science_fiction
when twelveyearold yip uses his fathers new software to make a computer simulation of a boy his age the creation breaks out of cyberspace into the real world and begins to complicate yips life,science_fiction
in a future world where global contamination has necessitated limited human contact three young people with unique genetically engineered abilities are teamed up to wage a war in virtual reality,science_fiction
unwillingly betrothed to korre totally unlike her curious self kyreol accepts an opportunity to accompany a friend on a trip to the end of their known world during which she explores many cultures and experiences troubling thoughts,science_fiction
having ended englands civil war between the roundheads and the royalists in 1645 the overlord of the holekhor a race from another world and his halfenglish son question the decision to colonize the island and convert their beloved english to a faith characterised by witches and myriad gods,science_fiction
each story preceded by 1 paragraph of commentary,science_fiction
when their classmates disappear from the circle of singing stones on the empty planet tim and sanchez try to solve the mystery,science_fiction
after tremendous earthquakes destroy the earths major cities an ancient evil emerges turning ordinary people into hunters killers and insane monsters but a small group of teens comes together in a fight for survival and safety,science_fiction
young paul atreides son of a powerful family from the planet caladan may be the lookedfor leader who will save the desert planet dune source of a precious spice which gives people strange mental powers,science_fiction
while visiting the toy and game fair on planet izz jeff and norby search for a missing robot and the villain responsible for sabotaging the planets computer system,science_fiction
scanned pages 162 and 163 are missing,science_fiction
josh lewis is unwillingly drawn into the computer experiments of aaron his friend and fellow classmate at an exclusive new york private school and the two find themselves uncontrollably transported through space and time,science_fiction
gabby nichols is putting her son to bed when she hears her daughter cry out mummy theres a daddy longlegs in my room then the screaming starts  alan travers is heading home from the pub when something rushes his face  a spiders web then something huge and deadly lumbers from the shadows  kevin alperton is on his way to school when he is attacked by a mosquito a big one then things get dangerousamazoncom,science_fiction
in a wartorn future united states fifteenyearold tessa her childhood friend gideon now a traumatized military hero and dek a streetwise orphan enter enemy territory and discover the shocking truth about a war that began more than seventyfive years earlier,science_fiction
sixteenyearold kaelyn challenges her fears finds a second chance at love and fights to keep her family and friends safe as a deadly new virus devastates her island community,science_fiction
when an asteroid threatens to destroy their space island the sole survivors of the destruction of the earth must find a new place to go to,science_fiction
the battle against the evil empire rages on as members of the alliance continue their struggle to end the era of darkness  by rescuing an imperial prisoner they face possibly disastrous consequences,science_fiction
seventeenyearold steve and mary gradually realize their strange sensations are glimpses of another world in the same time and spacea world they must choose to enter or lose forever,science_fiction
jubilee a mutant teen learns about her special powers from a group of other mutants called the xmen who are fighting robot police called the sentinels,science_fiction
when a scientists experiment to grow bigger vegetables threatens the whole earth the animals find a way to save the day,science_fiction
living in a time when people are the servants of automobiles and ruled by the master auto of the planet josette longs to leave her rollabout and try her legs,science_fiction
a scientist invents a time machine and uses it to travel to the year 802701 ad where he discovers the childlike eloi and the hideous underground morlocks,science_fiction
in a sequel to the star wars storybook and the empire strikes back storybook luke skywalker and his friends in the rebel alliance formulate a daring plan to battle with the empire and its evil leaders darth vader and the emperor,science_fiction
in his second adventure matterhorn finds himself transported by the maker 13000 years into the past and along with aaron the baron princess jewels and nate the great must find the talis that the sasquatch are guarding,science_fiction
luke confronts his father darth vader as the rebel fleet attempts to destroy the death star,science_fiction
in a future where most people have computer implants in their heads to control their environment a boy meets an unusual girl who is in serious trouble,science_fiction
a solution to the prohibitive cost of producing vehicles for further space explorations is tom swift jrs new goal but the success of the young scientistinventors project is threatened by the wily li ching a renegade scientist banished from his native land because of rebellious acts li ching is now the leader of a ruthless group intent on pirating scientific secretsbut li ching and his nefarious confederates are only partially responsible for toms troubles olin whaley an unscrupulous international criminal proves to be a second formidable obstacledespite the everpresent threats of sabotage and piracy tom and his friend bud barclay are soon taking toms latest invention the space kite  a twoman craft for training future space pilots  on its test flight the experiment turns into a harrowing experience when the boys are nearly marooned in outer spaceundaunted by the failure of the space kite tom quickly discovers the defect and decides to build a larger craft the cosmic sailer certain that he has found the key to economical space explorations the young inventor still has to conquer the sinister forces working against him how tom and the cosmic astronauts meet this challenge will keep the reader taut with suspense,science_fiction
danny dunn and his friends search for a legendary serpent in central africa,science_fiction
with his grandmothers new invention the antiboredom machine twelveyearold kieran finds that he can speed up time or travel back into the past but this ability soon creates more problems than it solves,science_fiction
in two related adventures travis fox and ross murdock are stranded on two separate planets where they discover that the fate of those worlds and possibly the galaxy itself will be determined by their actions,science_fiction
matthew looney and his crew are captured by space pirates while leading an expedition to explore the possibilities of colonizing a new planet,science_fiction
jason cooper vor and lootna kick a band of lizard pirates off the planet lumaloon in the further adventures of the intragalactic troubleshooting team,science_fiction
zach a human boy who is actually an extraterrestrial agent for the galactic union travels to californias lassen volcanic national park on a dangerous mission to save the earth from evil aliens known as the syndicate,science_fiction
jason meets cooper vor and lootna aliens from space now living on earth and travels with them to a distant planet in an attempt to retrieve a stolen energy crystal,science_fiction
fourteenyearold myron finds that he has become very interesting to a menacing alien from outer space,science_fiction
fifth grader jonas mcfee faces the temptation of becoming the awful terrible powerful one when he accidentally acquires a blue crystal from outer space giving him the power to get china on his television and make his car fly,science_fiction
a biography of the english author who has been called the first great science fiction writer with a discussion of his works,science_fiction
as the students at her school become increasingly caught up in the annual game of elimination zoe grows more and more convinced that the new girl in her eighth grade class is not what she seems,science_fiction
continues the adventures of luke skywalker whose first meeting with the droids and ben kenobi leads to the realization of his dreams,science_fiction
ash and her friends live in a future where they are the only human teenagers left but when ash is kidnapped and becomes a pawn in a power struggle among the formidable raptors who captured her she begins to reconsider her own humanity,science_fiction
the star kaats make an interplanetary journey to another kaat colony where life forms have grown to monstrous proportions and nearly exterminated the kaat colonists,science_fiction
in 2044 alex and his friends learn that the lord will help them when one by one they become trapped in a mysterious room at the superkids academy,science_fiction
muscular sixteenyearold paul tries to find his genetically stunted younger brother sam in the polluted ruins of watertown where sam is trying to cure himself with toxic dead water that alters the metabolism of those who drink it,science_fiction
on a visit to england susan finds herself mysteriously transported back to the time of world war ii where she meets a viennese jewish refugee and a prejudiced young boy who help her understand and appreciate her background,science_fiction
two seventhgrade friends help a shapechanging policeman from the planet rodinam as he tries to recapture an alien master criminal who can also change form,science_fiction
when an investigative space mission discovers the spaceship argo missing for 200 years the crew is trapped aboard the totalitarian microcosm of argo and the commander is selected for indoctrination into argo thought and behavior,science_fiction
after half of the worlds population is killed by a plague seven teenagers seek a better life in a nightmarish future by deciphering coded messages and trying to avoid the slashers,science_fiction
from santa fe new mexico to edinburgh scotland thirteenyearold adam adlar must elude police while being hunted by a dinosaur cometolife from a virtual reality game invented by his father who has gone missing,science_fiction
danny dunn tries to track down the missing manager of the local department store with the aid of a bloodhound robot,science_fiction
the previous novel pandoras star introduced the intersolar commonwealth a starspanning civilization of the twentyfourth century robust peaceful and confident the commonwealth dispatched a ship to investigate the mystery of a disappearing star only to inadvertently unleash a predatory alien species that turned on its liberators striking hard fast and utterly without mercy the prime are the commonwealths worst nightmare coexistence is impossible with the technologically advanced aliens who are genetically hardwired to exterminate all other forms of life twentythree planets have already fallen to the invaders with casualties in the hundreds of millions and no one knows when or where the genocidal prime will strike next against this backdrop captain wilson kime confides to paula myo chief investigator at the intersolar serious crimes directorate his belief that humans are being manipulated for more than a hundred years a shadowy cult the guardians of selfhood has warned that an alien with mindcontrol abilities impossible to detect or resist  the starflyer  has secretly infiltrated the commonwealth branded as terrorists the guardians and their leader bradley johansson have been hunted by paula but now evidence suggests that the guardians were right all along and that the starflyer has placed agents in vital posts throughout the commonwealth  agents who are now sabotaging the war effort is the starflyer an ally of the prime or has it orchestrated a fight to the death between the two species for its own advantage caught between two deadly enemies one a brutal invader striking from without the other a remorseless cancer killing from within the fractious commonwealth must unite as never before,science_fiction
with the aid of bartleby an enormous tower of london guard known as a beefeater nathan travels through time to stop his father from changing the past,science_fiction
when murder strikes at the reunion of a science fiction fan club it falls to writer jay omega to turn sleuthand separate science fiction from fact to catch the killer,science_fiction
young alien agent zack joins an archaeological dig in mongolia to ensure that there is no trouble from the dinosaurlike scientists from vrajs home planet who are on a similar dig nearby,science_fiction
as competing factions launch a campaign to find and seize control of priceless extraterrestrial meteorites killing anyone in the way to steal the rocks for their rumored power none of the thieves are aware of the deadly potential of the rocks true powers,science_fiction
call arkady a clone with a conscience or call him a traitor a member of the spacefaring syndicates arkady has defected to israel with a hot commodity a genetic weapon powerful enough to wipe out humanity but israels not buying it theyre selling itand arkadyto the highest bidder as the auction heats up the artificial life emancipation front sends in major catherine li drummed out of the peacekeepers for executing syndicate prisoners li has now literally hooked up with an ai who has lived many lifetimes and shunted through many bodies but while they have their own conflicting loyalties to contend with together theyre just one player in a mysterious highstakes game  publishers description,science_fiction
the net force investigates when monsters from a computer game threaten an annual computer gamers convention,science_fiction
although beset by otherworldly perils dante and his best friend bea continue to be dedicated to the overthrow of sigmundus and the dark powers that have latched on to his methods of authoritarian mindcontrol,science_fiction
young alien agent zack surly galactic patrol cadet vraj and shy human camper opal team up to find some duthwi eggs before they hatch and cause a planetwide disaster while the gnairt who were smuggling the eggs try to retrieve them,science_fiction
the fearsome iron giant becomes a hero when he challenges a huge space monster,science_fiction
as former enemies earth and palatine join forces to battle the hive an alien lifeform that is wreaking deadly havoc captain john farragut searches for the one man who may be able to stop the hive and ensure humanitys surivival,science_fiction
optimus prime and the autobots join with their new friends on earth to stop the decepticons,science_fiction
bullied in school and called piggy macfartland twelveyearold iggy longs to travel to another planet and live among extraterrestrials until an explosion transports him to a scary alternate reality,science_fiction
aerin renning and dane madousin struggle as incoming students at the most exclusive academy in the universe both hiding secrets that are too painful to reveal not realizing that those very secrets link them together,science_fiction
a collection of ten stories about the future by such authors as lois lowry katherine paterson and jon scieszka,science_fiction
belisarius the finest general of his or any age must save the world if he can guided by visions from a future that may never be he and a band of comrades penetrate the malwa heartland seeking the core of the enemys power against them are numbers savagery and an icy inhuman intelligence that is without weekness or mercycover,science_fiction
as the hero of this graphic novel who is shipwrecked and stranded on an island during a school field trip the reader is asked to make choices throughout the story to avoid being harmed by strange halfhuman creatures,science_fiction
